{
  "schema_version": 1,
  "model_id": "dark-su3-confining-synthetic",
  "observables": [
    "relic",
    "dd",
    "id"
  ],
  "verdict": "HARD_HALT",
  "model_props": {
    "analytic_module_status": "unregistered"
  },
  "per_observable": {
    "relic": {
      "observable": "relic",
      "status": "HARD_HALT",
      "active_chain": null,
      "ranked_alternatives": [],
      "blockers": [],
      "blocker_classes": [],
      "caveats": [],
      "per_candidate": [],
      "matrix_acknowledgement_warnings": []
    },
    "dd": {
      "observable": "dd",
      "status": "HARD_HALT",
      "active_chain": null,
      "ranked_alternatives": [],
      "blockers": [],
      "blocker_classes": [],
      "caveats": [],
      "per_candidate": [],
      "matrix_acknowledgement_warnings": []
    },
    "id": {
      "observable": "id",
      "status": "HARD_HALT",
      "active_chain": null,
      "ranked_alternatives": [],
      "blockers": [],
      "blocker_classes": [],
      "caveats": [],
      "per_candidate": [],
      "matrix_acknowledgement_warnings": []
    }
  },
  "placements": [
    {
      "position": "top",
      "content": "> **HARD HALT \u2014 EFT REWRITE REQUIRED**\n> This model's gauge structure requires an EFT rewrite before routing can proceed. Monte Carlo and analytic tools cannot handle this model in its current form.",
      "kind": "hard_halt_prompt",
      "exception_id": null
    }
  ],
  "diagnostics": {},
  "exit_code": 0,
  "axis_snapshot": {
    "A1": "SM + extra SU(N)",
    "A2": "[{'factor': 'GD', 'kind': 'dark', 'pattern': 'unbroken-confining'}]",
    "A3": {
      "has_dark_charged_fermion": true,
      "has_majorana": false,
      "has_chiral_bsm": false
    },
    "A4": {
      "n_higgs_doublets": 0,
      "cp_odd_scalar_present": false,
      "replaces_higgs": false
    },
    "A5": null,
    "A6": null,
    "A7": {
      "extra_colored_matter": false,
      "fields": []
    },
    "A8": "active"
  }
}
